<?xml version="1.0" encoding="UTF-8" standalone="yes"?>
<xs:schema version="1.0" xmlns:xs="http://www.w3.org/2001/XMLSchema">

  <xs:element name="Language" type="Language"/>

  <xs:element name="Languages" type="Languages"/>

  <xs:complexType name="Languages">
    <xs:sequence>
      <xs:element ref="Language" minOccurs="0" maxOccurs="unbounded"/>
    </xs:sequence>
  </xs:complexType>

  <xs:complexType name="Language">
    <xs:sequence>
      <xs:element name="ID" type="xs:int" minOccurs="0"/>
      <xs:element name="Language" type="xs:string" minOccurs="0"/>
    </xs:sequence>
  </xs:complexType>
</xs:schema>

